{
  "schemaVersion": 1,
  "colors": {
    "accent": "#7356c5",
    "positive": "#238636",
    "attention": "#9a6700",
    "critical": "#cf222e"
  },
  "typography": "system",
  "density": "comfortable",
  "shape": "rounded",
  "brand": { "logo": { "mode": "default" } },
  "phases": { "showDescriptions": true },
  "artifacts": { "showMetadata": true }
}
